iter	tier2_criterion_pct	tier2_p	proof_kib	status	files_changed	rationale
1	+0.7120	0.00	NA	discard	crates/backend/poly/src/eq_mle.rs	Bumped LOG_BATCHED_TILE_SIZE 14->15 (Zen 4 L2 1MB hypothesis). Regression +0.71% p=0.00 — 14 is local optimum, larger tile spills L2.
2	+1.0980	0.00	NA	discard	crates/whir/src/open.rs	De-nested rayon in combine_statement dense branch (outer chunks par -> seq, inner kept par). Regression +1.10% p=0.00 — outer par across chunks WAS load-balanced effectively, removing it lost throughput.
3	+0.2924	0.01	NA	discard	crates/whir/src/merkle.rs	with_min_len(16) on first_digest_layer{,_with_initial_state} par_chunks. +0.29% p=0.01 — rayon default splitting is fine, forcing larger chunks slightly hurts.
4	+7.2478	0.00	NA	discard	crates/whir/src/utils.rs	Limit rayon global pool to logical/2 (=8 physical cores) via OnceLock at start of precompute_dft_twiddles. Massive +7.25% regression p=0.00 — SMT IS net positive for this workload despite cache contention (the 14% in wait_until_cold isn't waste, it's efficient idle).
5	NA	NA	NA	discard	Cargo.toml	lto=fat + codegen-units=1 in leanMultisig profile.release. NO-OP — harness bench has its own [profile.release] with lto=fat already, leanMultisig main Cargo.toml profile doesn't propagate to harness. Identical binary hashes.
6	+0.0513	0.75	NA	discard	crates/backend/poly/src/eq_mle.rs	Shrunk LOG_BATCHED_TILE_SIZE 14 -> 12. +0.05% p=0.75 (NOISE). Confirms 14 is local optimum: iter 1 showed 15 hurts (+0.71%), iter 6 shows 12 is statistical noise. The constant is well-tuned.
7	NA	NA	NA	discard	crates/sub_protocols/src/quotient_gkr/sumcheck_utils.rs	Factor delta computations in pair_coeffs. COMPILE FAILED in sub_protocols lib (E0308) — my refactor swapped multiplication order: delta_nl*delta_dr is N*T which doesn't compile (only T*N supported via Algebra<N> on T). Reverted before correctness gate.
8	-0.2303	0.12	NA	discard	crates/sub_protocols/src/quotient_gkr/sumcheck_utils.rs	Factor common deltas in pair_coeffs (T*N order). -0.23% improvement but p=0.12 (not significant), below 1% gate. Suggests compiler already CSEs through inline expansion.
9	+17.9810	0.00	NA	discard	crates/whir/src/utils.rs	Column-major iteration in prepare_evals_for_fft_unpacked: parallelize over dft_n_cols, each thread writes one column with strided writes. Massive +17.98% regression — every thread writes to every cache line of output (false sharing across all 8 cores). Original contiguous-writes pattern is critical for parallel scaling.
10	+0.0183	0.89	NA	discard	crates/backend/poly/src/eq_mle.rs	Bumped #[inline] -> #[inline(always)] on add_or_set_pf, add_or_set_f, scale_and_add_pf. +0.018% p=0.89 PURE NOISE. Compiler already inlines these via #[inline] when beneficial; forcing always is no-op.
11	+0.3352	0.01	NA	discard	crates/whir/src/utils.rs	Row-chunked parallel iter for prepare_evals_for_fft_unpacked: par_chunks_exact_mut(dft_n_cols) instead of (0..out_len).into_par_iter().collect(). +0.33% p=0.01 small regression — rayon's parallel collect is more efficient than explicit chunking here.
12	-0.4079	0.00	NA	discard	crates/sub_protocols/src/quotient_gkr/sumcheck_utils.rs	Reapply pair_coeffs delta CSE: -0.41% p=0.00 CONFIRMED real signal — manual CSE saves ~2 redundant deltas per call (T*T sub) but compiler couldn't see across 3 inline expansions of sumcheck_quadratic. Below 1% gate so discard. STOP CRITERION: 12 consecutive discards reached, pausing.
13	-2.1718	0.00	NA	keep	crates/backend/koala-bear/src/poseidon1_koalabear_16.rs,crates/lean_vm/src/tables/poseidon_16/mod.rs	[medium, predicted -1.0 to -1.5%, actual -2.17%] Switch AIR mds_air_16 from Karatsuba (mds_circ_16, 72 mults) to FFT-MDS (mds_fft_16, 50 mults). 8 MDS calls per Poseidon AIR row → 176 mults/row saved. AIR Poseidon eval was ~10% of CPU. N=3 median -2.17% σ=0.32% all p=0.00. Calibration error: actual was 1.5× predicted — likely cache/ILP gains beyond raw mult count. Same identity already used in permute_simd; FFT helpers ungated, bound relaxed to PrimeCharacteristicRing+Mul<KoalaBear> to admit EFPacking.
14	+0.7039	0.00	NA	discard	crates/sub_protocols/src/quotient_gkr/sumcheck_utils.rs	[medium, predicted -0.7 to -1.5%, actual +0.70%] Bundled pair_coeffs CSE (iter 12 had -0.41% alone) + register-keep folded values in fold_and_compute_round_packed (avoid &mut[EFPacking] reload). N=3 median +0.70% σ=0.75% mean +0.66% — REGRESSION. Calibration error: predicted -1%+, actual +0.7% (1.7%-pt overestimate). Hypothesis disproven: the [EFPacking::ZERO; 4] initialization adds 40 zmm zero stores per inner i, dominating CSE's small gain. Compiler likely already eliminates the &mut[EFPacking] reload via store-to-load forwarding (just-stored values hit L1 + cpu pipeline). Lesson: don't introduce stack-array zeroing in hot loops; use uninit MaybeUninit if needed. CSE alone (iter 12) was real -0.41%; would need to apply WITHOUT the array trick.
15	+0.0731	0.63	NA	discard	crates/backend/air/src/constraint_folder/{mod.rs,packed.rs},crates/backend/sumcheck/src/sc_computation.rs,crates/lean_vm/src/tables/table_trait.rs,crates/sub_protocols/src/air_sumcheck.rs	[medium, predicted -0.2 to -0.6%, actual +0.07% median (mean +0.49%, sigma 1.01%)] Pre-pack alpha_powers in ExtraDataForBuses (added Vec<EFPacking> + AlphaPowersPacked trait + bound updates), eliminating EFPacking::from(scalar) (5 vpbroadcastd) per assert_zero call. Hypothesis disproven: noisy result with one bad round (+1.64%) skewing mean positive. Lesson: pre-broadcast trades scalar broadcast cost (cheap, ~1 cycle) for L1 cache traffic increase (16x more bytes per element load: 320 vs 20 per packed value). Loading 80 packed-quintic alpha_powers (25KB) compared to 320B unpacked — fits in L1 either way, but cache pressure shifts and broadcasts were already cheap. Pattern that worked for logup_alphas/bus_beta (single fixed values) does NOT scale to per-constraint alpha_powers Vec.
16	+0.4965	0.01	NA	discard	crates/lean_vm/src/tables/poseidon_16/trace_gen.rs	[micro, predicted -0.1 to -0.3%, actual +0.50% median (mean +0.91%, all 3 rounds positive p<=0.01)] Apply mds_fft_16 (50 mults) to Poseidon trace generation generate_2_full_round + generate_last_2_full_rounds (replacing mds_circ_16 / 72 mults Karatsuba). Same change shape as iter 13 (-2.17% in AIR), but here REGRESSED. Surprising calibration error: predicted micro-improvement, got medium regression. Lesson: same MDS swap helps AIR eval but hurts trace gen. Hypothesis: trace gen runs 8 sequential MDS calls on FPacking with tight data dependency chains; FFT MDS has longer serial dep chain (DIF_IFFT then 16 mults then DIT_FFT) than Karatsuba (independent recursive halves). AIR eval's MDS calls are SCATTERED across constraints with intervening work, masking dep chain latency. Trace gen is a TIGHT LOOP where ILP/parallelism in Karatsuba beats the FFT's lower mult count. Also possible: monomorphization of mds_fft_16 for FPacking type hurts ICache. Lesson: don't reuse algorithmic wins across different code paths without separate measurement.
17	NA	NA	NA	wip	-	[wip cross-system, 0 stop counter] Read SP1 (slop/veil/protocols/sumcheck.rs, 305 LoC) and Plonky3 (poseidon1-air, poseidon2-air) to compare sumcheck and Poseidon-AIR implementations. Findings: (a) SP1 sumcheck is a generic high-level abstraction batching polys via lambda RLC; LeanMultisig has specialized per-protocol kernels (quotient_gkr, product_computation) that are more optimized. No port-target there. (b) Plonky3 Poseidon1-AIR commits HALF_FULL_ROUNDS post-MDS witness columns (vs LeanMultisig's HALF_INITIAL_FULL_ROUNDS = HALF_FULL_ROUNDS/2 — already a 2x witness reduction). LeanMultisig wins on column count. (c) Plonky3 partial round transition: same dense m_i × state pattern (mds_multiply 256 mults). Same as LeanMultisig. NEITHER exploits m_i's identity-like sparsity (top row [1,0,...,0], left col [1,0,...,0]^T). That's an unexplored lever. (d) Plonky3 MDS uses dense matrix-vector (256 mults) — STRICTLY worse than LeanMultisig's FFT-MDS (50 mults post-iter-13). LeanMultisig already ahead. Action: iter 18 will exploit m_i sparsity in dense_mat_vec_air_16 (predicted ~0.20% below gate, but structural attempt counts 0).
18	-0.0926	0.69	NA	discard	crates/lean_vm/src/tables/poseidon_16/mod.rs	[micro, predicted -0.20%, actual -0.09% median (mean -0.11%, sigma 0.50%) — NOISE around zero] Exploit m_i identity-like sparsity at partial-round transition: skip row 0 (m_i[0]=[1,0,...,0] -> state[0] unchanged) and col 0 (m_i[i][0]=0 for i>=1 -> skip j=0 in dot products). 31 mults saved per AIR row out of 1444 = 2.1% mult reduction. Statistically zero effect. Lesson: compiler already constant-folds the static-zero m_i entries via dead-code elimination on multiplications by zero. Manual sparsity pattern matching is REDUNDANT when matrix entries are 'static OnceLock data — Rust can't const-fold them BUT mul_kb dispatches via TypeId, so the multiplication operations themselves still run; the packed types may eliminate broadcast-of-zero patterns at runtime. Either way, no speedup observed.
19	+0.5191	0.00	NA	discard	crates/backend/koala-bear/src/poseidon1_koalabear_16.rs,crates/lean_vm/src/tables/poseidon_16/mod.rs,crates/lean_vm/src/tables/poseidon_16/trace_gen.rs	[structural, predicted -0.3 to -0.5%, actual +0.52% median (mean +0.63%, sigma 0.24%, all 3 rounds p<=0.01)] Fuse last-initial MDS + add_first_rc + m_i transition into single (m_i*MDS)*state + (m_i*first_rc) — same fusion permute_simd uses at runtime. Hoisted fused_mi_mds and fused_bias from SimdPrecomputed to top-level Precomputed; added eval_2_full_rounds_16_no_final_mds and generate_2_full_round_no_final_mds variants for the last initial pair so witness captures post-cube state. CONSISTENT REGRESSION. Hypothesis disproven: predicted savings (50 mults from skipping MDS) didn't materialize. Lesson: 256-mult fused dense multiply has all-dense access pattern; original split (50-mult FFT MDS + 256-mult m_i with identity-like sparsity in m_i row 0 / col 0 that the compiler likely exploits via const-fold for the static OnceLock data) likely has BETTER ILP. Same lesson as iter 16: tight-loop dense matmul on packed types is ILP-limited, not mult-count-limited. The fusion that wins for permute_simd's hand-tuned SIMD path does NOT win for the generic AIR path through TypeId dispatch. Structural attempt = 0 stop counter. Now confirmed-well-tuned: AIR Poseidon partial-round transition.
20	+0.2466	0.37	NA	discard	crates/sub_protocols/src/quotient_gkr/sumcheck_utils.rs	[micro, predicted -0.3 to -0.5%, actual +0.25% median (mean +0.23%, sigma 0.20%) — NOISE around zero, slight regression] Re-apply pair_coeffs CSE alone (factoring delta_dl, delta_dr, delta_nl, delta_nr) without iter 14's array trick. Iter 12 had confirmed -0.41% real signal pre-iter-13. Post-iter-13, the signal DOES NOT REPRODUCE. Hypothesis: iter 13's FFT-MDS replacement changed surrounding compiler decisions (LTO/inlining/scheduling), and the manual CSE pattern that previously helped is now neutral or slightly harmful. Lesson: micro-optimizations are baseline-dependent — what helps one configuration may not help after a structural shift. The bundle rule cannot reliably compose iter 12's signal forward across other changes.
21	+0.4948	0.00	NA	discard	crates/lean_prover/src/prove_execution.rs	[medium, predicted -0.5 to -1.5%, actual +0.49% p=0.00 single-round REGRESSION] Parallelize "Building memory access count" histogram (TODO parrallelize loop) via AtomicU32 view + per-column par_iter relaxed fetch_add, then par_iter map u32->F. Hypothesis disproven: original sequential F::ONE += loop runs ~3-4 cycles/op (Mont add+cond sub p) and processes ~16M iterations in ~16ms — already <0.5% of 2.85s total. Replacing with `lock xadd` + cache-line contention costs ~5-10x per-op, plus the par_iter conversion at end. Lesson: a "// TODO parallelize" marker is not evidence it matters. Sequential-but-tiny loops on cache-resident data are not parallelization candidates — the constant factor of synchronization dwarfs the speedup. Allocation patterns surface (1.4% in malloc/cfree) and small sequential loops on already-fast field ops are NOT structural levers. The 16M-element loop was at most 16ms = 0.6% of total. Brain's surface 5 (allocation patterns) appears exhausted in the simple form; would need actual ARENA pooling of the LARGE buffers (DFT input prep, Merkle digest layers) rather than counter loops.
22	+0.1671	0.34	NA	discard	crates/whir/src/merkle.rs,crates/backend/symetric/src/merkle.rs	[medium ~143 LoC, predicted -0.2 to -0.5%, actual +0.17% median (mean +0.11%, sigma 0.29%) — NOISE around zero] Batch 4 SIMD compresses per parallel task in compress_layer + first_digest_layer{,_with_initial_state}. Hypothesis: ~12% in rayon bridge_producer_consumer::helper across 7 monomorphizations is partially attributable to fine-grained chunk dispatch (1 SIMD compress = ~1500 cycles per chunk). Test: increase per-task work 4x by looping BATCH=4 sub-chunks. Hypothesis disproven. Lesson: rayon's adaptive splitting already amortizes scheduling overhead — its bridge_producer_consumer cost shows up at the ITER level not per-chunk level. par_chunks_exact_mut(N) creates fixed-size chunks but rayon batches them into worker tasks adaptively. Manual batching doesn't reduce the deeper plumbing cost. The 12% in helpers represents real coordination work (split-and-join recursion across 8 cores), not removable overhead. Confirmed-well-tuned: Merkle parallelism granularity. Stop counter: 4.5 + 0.5 = 5.0/12.
23	-2.8597	0.00	373	discard	crates/lean_prover/src/lib.rs	[medium structural, predicted -0.5 to -2%, actual -2.86% median (mean -2.70%, sigma 0.76%, all 3 rounds p=0.00)] Increase RS_DOMAIN_INITIAL_REDUCTION_FACTOR 5->6: shrinks first-round folded domain by 2x, reducing per-round Merkle commits at cost of more queries. Time gate PASSED comfortably (-2.86% > 1.0% threshold). HOWEVER proof size grew from 340 KiB -> 373 KiB (+9.7%). Per scoring rule net = throughput_pct - 3 * proof_size_increase_pct = 2.86 - 29.1 = -26.2 — UNSHIPPABLE despite real throughput win. Hard ceiling 20% not breached but score weighting kills it. Lesson: rs_domain_initial_reduction_factor IS a valid throughput lever (untested in exp5 between 5 and 8) but the 3:1 proof-size penalty makes the trade negative. Production target is 128 KiB; we're already 2.7x over at 340 KiB so any size growth compounds the gap. Confirmed: changing query-vs-leaf-hashing trade-off via RS factor moves both throughput and proof size in opposing directions. Lever ruled out for production. Stop counter: 5.0 + 1.0 = 6.0/12 (medium discard counts 0.5? but it's only 1 LoC -> micro discard, counts 1).
24	-0.0151	0.94	361	discard	crates/lean_prover/src/lib.rs	[micro, predicted -1.5 to -2.5%, actual -0.02% median (mean -0.15%, sigma 0.31%) — NOISE around zero] Combined iter 23's rs=6 with pow=18 (vs default 16) to compensate for query growth via more PoW. Time gate: NOISE — pow grinding cost (~0.5% slower per exp5) approximately offset rs=6's gain (-2.86%), netting near-zero. Proof: 361 KiB (vs 340 baseline, +6.2%). Net = -0.02 - 3*6.2 = -18.7 STILL UNSHIPPABLE. Lesson: pow_bits 16->18 only partially compensates for the extra queries needed at rs=6. The query count formula isn't linear in pow, so the trade isn't 1:1. Confirmed-explored: rs/pow joint tuning space is unfavorable - the throughput-vs-proof tradeoff is fundamental and can't be circumvented via PoW. Stop counter: 6.0 + 1 = 7.0/12 (5.0 budget left).
25	NA	NA	319	discard	crates/lean_prover/src/lib.rs	[micro single-shot, predicted -1% wall + ~5% proof shrink, actual +7.5% wall (single-shot 2.856s -> 3.069s) + 6.2% proof shrink (340 -> 319 KiB)] GRINDING_BITS 16->20: more PoW per query, fewer queries needed. Throughput regression way above gate threshold; reverted without paired gate. Proof shrink confirmed (-6.2%) but cost too high. Per scoring: net = -7.5 - 3*(-6.2) = +11.1 (positive in symmetric reading) but throughput regression 7.5x above 1% gate. USER NUDGE: stopped cycling rs/pow tuning - this whole space of 1-line constant changes is exhausted. Stop counter: 7.0 + 1 = 8.0/12 (4.0 budget left). Pivoting to a fundamentally different surface.
26	NA	NA	340	discard	crates/lean_prover/src/prove_execution.rs	[micro single-shot, predicted 0.0-0.5%, actual ~0% (single-shot 2.875s vs ~2.85s baseline) - BELOW NOISE FLOOR by analysis] Overlap memory_acc and bytecode_acc histogram builds via rayon::join. Different mechanism from iter 21 (which atomic-parallelized within memory_acc). The two histograms are independent serial loops; joining lets them run on 2 cores. Expected saving = min(time_memory_acc, time_bytecode_acc) = bytecode_acc time ~1ms, vs total ~16ms histogram phase. Theoretical max savings ~0.04% of 2.85s. Skipped paired gate; single-shot confirms below threshold. Lesson: parallelism orchestration via join can't make small loops smaller — only valuable when both branches have substantial work. Stop counter: 8.0 + 1 = 9.0/12 (3.0 budget left).
27	NA	NA	NA	wip	-	[wip crypto analysis, 0 stop counter] Sponge rate analysis: RATE=8->12 with CAPACITY=4 at WIDTH=16. Standard sponge collision security = capacity * log2(p) / 2. KoalaBear log2(p) ~31. Current c=8: 8*31/2 = 124-bit collision (matches SECURITY_BITS=124). Proposed c=4: 4*31/2 = 62-bit collision. NOT 123-bit as suggested - the user's claim was off by 2x; actual security drop is 124->62 bits. RULED OUT: 62-bit collision is unshippable (catastrophic). Code constraints: sponge.rs asserts RATE==OUT==WIDTH/2 hardcoded; DIGEST_LEN_FE=8 hardcoded throughout; would require relaxing OUT!=RATE which is a sponge security mode change. Workaround would need Poseidon-24 (rate=16, capacity=8 -> 124-bit) but NOT available in mt-koala-bear (only Poseidon1KoalaBear16 implemented). Verified bytecode caching: get_aggregation_bytecode uses OnceLock; init only called once per process. Setup-amortized. NOT a per-proof lever. Both user-suggested structural levers ruled out by analysis. Budget unchanged: 9.0/12.
28	-0.4393	0.01	NA	discard	crates/whir/src/dft.rs	[structural ~262 LoC, predicted 1-3% on DFT pipeline, actual -0.44% median (mean -0.40%, sigma 0.68%, p={0.01, 0.0, 0.24}) — REAL SMALL SIGNAL but below 1% gate] DFT LAYERS_PER_GROUP 3->4 with new apply_4_layers butterfly. Added QuadLayerBlockDecomposition (16 sub-blocks), fft_quad_layer_{single,double,quad,octa}_twiddle helpers, dft_layer_par_quad. 16 zips with deeply nested closure pattern. Hypothesis: more layer fusion = less cross-thread data movement. Result: 2/3 rounds improved (-0.44%, -1.06%), 1 round regressed (+0.29%). Variance σ=0.68% suggests register pressure on Zen 4 starting to bite at 4-layer fusion (32 ZMM regs needed for 16 sub-blocks + twiddles approaching limit). Lesson: Plonky3's choice of 3 is locally optimal on AVX-512 KoalaBear; going to 4 yields marginal gain but isn't reliably above noise. Structural attempt costs 0. Stop counter unchanged: 9.0/12.
29	NA	NA	NA	wip	-	[wip crypto analysis, 0 stop counter] Detailed sponge rate analysis WIDTH=16 RATE=12 CAPACITY=4 with KoalaBear (log2 p ~ 31). STANDARD SPONGE BOUNDS (Bertoni et al, 2011): collision = c*log(p)/2 = 4*31/2 = 62 bits; preimage = c*log(p) = 4*31 = 124 bits; 2nd-preimage = c*log(p) = 124 bits. The user's "124 vs 123" matches PREIMAGE (not collision) — this is consistent ONLY if the protocol's binding security relies on preimage rather than full collision resistance. STANDARD SNARK ANALYSIS uses collision resistance for Merkle binding (adversary commits to multiple openings of same root). Strict reading: c=4 KB gives 62-bit collision = INSUFFICIENT for SECURITY_BITS=124. Mitigations: (a) Beetle-mode sponge construction gives c*log(p) collision (124 bits matches target) — requires non-trivial protocol change beyond rate parameter. (b) SAFE sponge with explicit domain separation similar bound. (c) Plonky3 koalabear uses width=16 capacity=8 = 124 bits collision — matches our current. (d) Poseidon-24 width=24 rate=16 capacity=8 — gives 124 bits AND rate=16; not implemented. PROCEEDING WITH IMPLEMENTATION per user directive: this is structural=0 cost, gate-tested for throughput, security ruling left to external review. The Beetle/SAFE consideration would be the actual shippable variant if performance pans out. Code changes: sponge.rs relax RATE==OUT and WIDTH==OUT+RATE asserts; merkle.rs use RATE=12 in build_merkle_tree_koalabear and merkle_verify; fiat-shamir verifier.rs use RATE=12.
