iter	tier1_delta_pct	tier1_p	tier2_delta_pct	allocs_delta_pct	status	files_changed	rationale
1	-72.32	0.000	-4.28	-25.00	keep	prover_common.go	MulAccByElement for ext×base in Regular case — 4 base muls vs 9 (Karatsuba), fused multiply-accumulate with AVX-512, eliminates scratch buffer
2	-1.89	0.008	+0.92	-33.33	keep	prover_common.go	Eliminate localLinComb alloc+copy — accumulate directly into shared linComb slice (disjoint ranges). -50% B/op, -33% allocs/op
3	+0.50	-	-1.76	-93.86	keep	poseidon2.go	Fix MDHasher.SumElement buffer realloc — index-based consumption preserves backing array. no_sis allocs 16438→62 (-99.6%)
4	+0.68	-	+0.01	+0.80	discard	commtiment.go	Pre-extract Regular slices in noSisTransversalHash — interface dispatch overhead is negligible vs Poseidon2 compute
5	-1.21	0.015	+0.66	+0.00	discard	prover_common.go	Defer constant additions + MulByElement (4 vs 9 muls) — mixed case -7.16% but geomean -1.21% (only 1/4 benchmarks has constants)
6	+1.14	-	-14.00	-40.43	keep	commtiment.go	CompressPoseidon2x16 SIMD for noSisTransversalHash — batch 16 columns at a time. rows_512/no_sis: -72.36%
7	-0.13	-	-0.13	+2.25	discard	commtiment.go	Pre-extract Regular slices for SIMD transpose — interface dispatch not the bottleneck, cache misses dominate
8	-0.68	-	-1.60	+0.00	discard	commtiment.go	Swap transpose loop order (row-major) — rows_512 -8.19% but geomean -1.60% below threshold
9	+0.21	-	-0.77	+2.25	discard	commtiment.go	Combined loop swap + pre-extract — worse than loop swap alone, pre-extract overhead cancels cache benefit
10	+0.17	-	+1.02	+0.00	discard	gnark-crypto/fft.go	Fuse butterfly+twiddle in FFT generic path — regression, separating allows better instruction pipelining
11	-0.09	-	-17.00	+0.00	keep	gnark-crypto/fft.go,go.mod	Add kerDIFNP_64/128 + replace directive — unrolled FFT kernels eliminate ~63 recursive calls per 64-element FFT. SIS benchmarks -28%
12	+0.38	-	-11.20	+0.00	keep	gnark-crypto/fft.go	Inline small-m stages in kerDIFNP_64/kerDITNP_64 — eliminate innerDIFWithTwiddlesGeneric dispatch overhead. SIS -22%
13	+0.74	-	+0.00	+0.00	discard	gnark-crypto/fft.go,domain.go	Pre-compute cosetTableInvScaled to merge FFTInverse passes — N=64 too small for one-pass merge to matter
14	+1.30	-	+3.30	+0.00	discard	gnark-crypto/options.go	Cache OnCoset/WithNbTasks closures — regression, cached vars prevent compiler inlining of closures
15	+1.10	-	+2.17	+0.00	discard	gnark-crypto/fft.go	Direct AVX-512 calls from kernel — regression, Go compiler already constant-folds dispatch check
16	+1.97	-	+0.02	-63.42	keep	gnark-crypto/fft.go	Inline coset/CardinalityInv scaling for nbTasks<=1 — skip parallel.Execute closure. SIS allocs -85% to -93%, B/op -42%
17	+0.43	-	-4.59	+0.00	keep	gnark-crypto/fft.go	2x unroll butterfly+twiddle in kerDIFNP_64/kerDITNP_64 for ILP across Montgomery multiply chains. SIS -3% to -5%
18	-0.68	-	-1.67	+0.00	discard	gnark-crypto/fft.go	Extend 2x unroll to stage 4 (m=2) — diminishing returns, geomean -1.67% below threshold
19	-0.63	-	+7.09	+0.00	discard	gnark-crypto/fft.go	Fuse stages 4+5 in kerDIFNP_64 — regression (+7% geomean, no_sis benchmarks drifted 20%, likely system noise + bad codegen)
20	-0.33	-	-0.53	+0.00	discard	gnark-crypto/fft.go	Direct kernel dispatch from Domain.FFT for n=64/128 — below threshold, difFFT dispatch already fast
21	+0.35	-	-0.39	+0.00	discard	gnark-crypto/fft.go	Preload twiddles into locals + fully unroll multiply — Go compiler already eliminates bounds checks
22	+0.13	-	-2.25	-18.33	keep	gnark-crypto/sis/sis.go	Eliminate function pointer in LimbIterator.NextLimb — branch on limbSize instead. SIS -4%, allocs -33%, B/op -7%
23	+0.38	-	-0.38	+0.00	discard	gnark-crypto/sis/sis.go,element.go	Skip byte buffer in LimbIterator via ToRegularUint32+bitshift — montReduce dominates, byte overhead is small
24	+0.04	-	-0.77	+0.00	discard	gnark-crypto/sis/sis.go	Pool k buffer in SIS Hash via sync.Pool — SIS B/op -36% but ns/op geomean -0.77% (below threshold), allocs unchanged
25	+0.25	-	-3.33	-29.25	keep	gnark-crypto/sis/sis.go	Embed vector in LimbIterator — eliminate interface+heap escape. SIS -6 to -8%, allocs -50%, B/op -5%
26	+0.55	-	+5.28	+0.00	discard	gnark-crypto/sis/sis.go,vector*.go	Fused MulAddAssign in SIS InnerHash — regression, Go scalar loop loses to separate AVX-512 Mul+Add
