iter	hyp_id	predicted_pct	measured_pct	proof_kib	status	files_changed	rationale	diagnostic
1	h1	-5.5	-5.29	508	discard	air_sumcheck.rs,univariate_skip.rs,skip_round.rs,verify_execution.rs,prove_execution.rs,recursion.py,compilation.rs	Gruen 2024/108 univariate skip k=5 + p20 Lagrange->tensor conversion (plan_spec_v2); wall -5.29% p~0, recursion -2.22%, BUT proof 500->508KiB (+1.6%) -> net 0.49 < 1.0 after 3x penalty	DISCARD by proof-size net-scoring, not implementation: transcript floor (~256EF skip msg + 133EF ghat duplication = +1.55%) costs 4.65 net pts vs window-bounded wall ceiling ~5.3% (rounds 0..4 = 624.5ms). k=4/k=6 strictly worse. Family closed under current gate economics; reopens if penalty multiplier drops, proofs grow >=2MB, or a transcript-free skip variant appears
2	h3	-3.0	-0.85	500	discard	field.rs,goldilocks.rs,x86_64_avx512/packing.rs,product_computation.rs (+T5' quotient_gkr/sc_computation reverted in-iter)	Deferred-reduction lazy accumulators (p12+p13, Pornin 2022/274 + BDT 2024/1046 cost models): T4 kernel vectorization verified -8.6% span / -0.85% e2e (p~0), proofs byte-identical, recursion -0.26%; T5 (product_computation ext-ext arms) killed: production-dead code; T5' (relocated to live GKR+WHIR-rounds-1+ kernels) killed: economics INVERT at live sites (+1.7% span)	DISCARD: real-but-sub-threshold (-0.85% < -1.0% keep bar). Mechanism PROVEN at Target A, under-sized as a standalone hypothesis. T5/T5' measurement-closed deferred ext-ext accumulation at every located live site (accumulator-state traffic > saved reductions). Latent for re-land: T4 kernel (commit 5ddf2fcc) inside a properly-sized same-subsystem hypothesis; T1-T3 vocabulary in history. Replacement must clear 1.0% alone: h6-enriched (round-eval reuse + T4 re-land) ~ -2.4..-2.9 or h4 (DFT kernel) -2.5
3	h6'	-3.0	-5.21	500	keep	air_sumcheck.rs,air/lib.rs,tables/poseidon/mod.rs,tables/execution/air.rs,field.rs,goldilocks.rs,x86_64_avx512/packing.rs,product_computation.rs	Transcript-free round-eval acceleration: C1 re-land of verified vectorized base-x-ext kernel + C3a poseidon degree-deficit skip (declared deg 8, true deg 7 - redundant z=8 eval pass removed, -72ms) + C2 Gruen-2024/108-section-4 adapted to non-zerocheck (per-pair C-tables + bus-only round-0 seeding, -73ms combined; exec class auto-disabled by its kill switch after measured regression) + C4 killed at gate (eq spans 0.15ms vs 30ms bar). All proofs byte-identical (frozen verifier accepts); recursion -3.14 pct FASTER; proof +0.00 pct	KEEP at -5.21 pct (p~0, t=-43.6, 4x4 warm samples, noise 0.12 pct); steady-state -5.38 pct (t=-143). Beat prediction ceiling (-4.5): C2+C3a compounding on the poseidon EF rounds exceeded the 35-pct-haircut model. AIR phase 766->624ms. First keep of the experiment. Lessons validated: net-scored selection (proof delta 0 by construction), per-component kill gates (C4, exec-C2 killed cheap), verified-component re-land (C1)
4	h11	-2.0	-0.59 (unrealized; killed at midpoint)	500	discard	runner.rs (T1, never committed), tables/poseidon/mod.rs (T2a cfc10a7d, reverted b1e454a0), prove_execution.rs (T3, never committed)	VM interpreter acceleration: plan attribution found 68% of the exec window = native Poseidon witness via slow fully-reducing mds_vec_mul + 55-60ms serial merge tail. T2a (witness MDS u128 scheme) passed ALL gates: kernel 2.24x, witness 1.88x, -21.3ms span, proofs byte-identical. T1/T3 killed at their gates	KILLED at the plan's own midpoint bar (cumulative 21.3ms < 25ms): T1's merge-tail attribution was a COLD-ARENA CLI ARTIFACT — warm prove_loop arenas make baseline merge cheap (plan profiled the wrong workload); T3 capped by false sharing (1.27x). LESSON: profile the GATE WORKLOAD (warm prove_loop), never the CLI. T2a banked as verified re-land (cfc10a7d; C1-precedent). Next: h9-revised (sound subset: virtualization+merges, net -4.2, verifier-depth)
5	h9-A	-3.3 (A-only model; -4.0 full)	-4.01	~369 (-1.40%)	keep	execution/air.rs,trace_gen.rs,table_trait/enum.rs,logup.rs,prove/verify_execution.rs,stacked_pcs.rs,recursion.py,compilation.rs (+harness soundness_check.rs compat fix)	Sound subset of small-value packing after the grounding/rank analysis killed literal packing: A = address-column virtualization (ADDR_A/B/C -> degree<=3 closed forms of committed cols; 3 memory buses -> deferred composite-denominator claims at fresh AIR alpha slots, Multiplicity::Column precedent; 20->17 exec cols, 6 fewer GKR evals + 6 fewer WHIR statements). T4/B (mode merge) implemented then KILLED at its span gate: -2 cols padding-absorbed at the 2^26 boundary, exec air_poly +62ms > 45 bar, e2e +5% incl. an unexplained Merkle +10%; T5/C mooted (stacks on B). Recursion +0.91% wall, bytecode -0.03% (checkpoint PASS); adversarial 95/95; frozen-verifier rejection = anticipated tripwire (attribution + grounding argument in report/iter5_T6_correctness_record.md)	KEEP at -4.01% (p~0, 4 rounds -3.47..-4.52, noise ok), recursion -4.14% FASTER, proof -1.40% SMALLER (first transcript-shrinking keep; net rule pays bonus). A-only beat its -3.3 model. Padding-absorption lesson: column-removal value is quantized by the 2^20 block and 4-col leaf-absorb boundaries — compute residual-vs-boundary BEFORE pricing any column removal (T4's -2 cols bought zero commit-side)
6	h12	-1.4	-2.05	~369 (+0.00%)	keep	tables/poseidon/mod.rs,tables/poseidon/trace_gen.rs,backend/goldilocks/x86_64_avx512/packing.rs	Verified-residuals composite (C1 re-land precedent): C-1 cherry-pick cfc10a7d witness MDS u128 kernel (witness 175.3->152.3ms, -23ms, byte-diff IDENTICAL); C-2 packed deferred-aux witness pass behind >=2.5x microbench pre-gate (witness 153->124.3ms, -29ms, byte-diff IDENTICAL, deferred_aux_fill_equals_scalar equivalence test); C-3 combine_statement region-pass fusion PASSED its >=60ms pre-gate but FAILED its >=25ms post-gate (combine 155->139ms = -16ms) -> reverted uncommitted per plan. Implementation agent died mid-C-3 suites; parent completed gates from on-disk artifacts (takeover pattern)	KEEP at -2.05% (p~0, t=-21.6, rounds -1.62/-2.15/-1.89/-2.56), recursion -1.24% FASTER, proof +0.00% byte-identical -> net = wall. Beat the -1.4 model: packed aux pass pays beyond its own witness span (cache effects in stack_polynomials path). Witness subsystem now ~124ms (was 175). h10-c1 fusion family CLOSED: measured ceiling 16ms is workload-shape-bound (small fusable span), not implementation. Correctness: exit 0 --expect-protected-changes; L0.7/L0.8 fails inherited (pre-existing fork unimplemented!(); frozen pre-h9 verifier vs post-h9 format) with byte-identity to accepted baseline as the stronger guarantee
