iter	hypothesis_id	predicted_pct	measured_pct	proof_kib	status	files_changed	rationale	diagnostic
1	h1	-3.5	-0.19	—	discard	4	Early MerkleData release before sumcheck: freed tree buffers between opening and sumcheck to reduce dTLB pressure	Δ=-0.19% p=0.195 (noise). Working set reduction (~5-6%) too small; freed pages not TLB-resident during sumcheck anyway since they weren't accessed. Revert a992263e.
2	h4	-8.0	+80	—	discard	2	MAP_HUGETLB in zk-alloc arena mmap to use 2M pages, reducing dTLB miss rate	dTLB miss rate 51%→4% (success) but L3 cache set coloring penalty from 2M page alignment caused +80% regression. 28% more instructions, IPC 0.89→0.78. THP also broken on 6.8.0-100-generic (THPeligible=0 regardless of madvise hint). Revert ab99cef3.
3	h5	-1.5	+0.68	—	discard	2	with_min_len(64) on Merkle parallel loops to reduce Rayon work-stealing overhead	Statistically significant regression +0.68% p=0.001. Coarser task granularity hurt load balancing more than it saved in dispatch overhead. Rayon's fine-grained work-stealing is load-balancing uneven Poseidon hashing work. Revert 97af3032.

4	h6	-10.0	-20.03	—	keep	6	Blake3 hybrid Merkle leaf hashing for WHIR: Blake3 for leaves, Poseidon for internal nodes. O'Connor et al. 2020 (BLAKE3 spec §2-3) + Ben-Sasson et al. 2018/740 §5.2 — transparent Merkle needs only CRH, not algebraic friendliness. Updated prover (merkle.rs), verifier (merkle_verify_blake3), and proof-pruning restoration (fiat-shamir verifier.rs).	Δ=-20.03% p=0.0, ship-gate -13.98% vs origin/main, steady-state Δ=-21.19% p=0.0 (50 proofs after 200 warmup). Prediction -10% conservative — underestimated gather/scatter overhead eliminated by sequential Blake3 serialization + Montgomery reduction savings. Commit 9aeb9d74.
5	h10	-1.5	-0.22	—	discard	2	Raw Montgomery-form Blake3 leaf hashing: skip to_unique_u32 serialization, reinterpret &[KoalaBear] as &[u8] directly. Montgomery 1985 (bijection on [0,p)) + O'Connor et al. 2020 (BLAKE3 §2, CRH for arbitrary bytes). Applied to prover merkle.rs and fiat-shamir verifier.rs.	Δ=-0.22% p=0.265 (noise). Blake3 leaf hashing is only 2.33% of total; serialization overhead (alloc+convert+copy) was ~0.9% additional at most. Compiler likely auto-vectorized the to_unique_u32 loop making it nearly free. Noise floor 0.75% exceeded signal. Kill condition confirmed: serialization was not the bottleneck. Revert 479a3f29.
6	h11	-4.0	+0.23	—	discard	1	Fused eq fold in run_phase1_sumcheck: replace per-round eval_eq_packed recomputation with in-place fold. Thaler 2013 §3.2 + Setty/Thaler/Walfish 2012 §4.1 — incremental eq bookkeeping table. Fold eq_within in place: new[i]=old[i]*(1-r)+old[i+half]*r, track eq_scale, divide coefficients.	Δ=+0.23% p=0.35 (noise). Fold does 2 muls+1 add per element vs eval_eq_packed's 1 mul per element in binary recursion — fold is NOT cheaper per element despite operating on shrinking array. Additionally, per-round eq_scale.inverse() (extension field inversion) adds overhead that nullifies any memory-access savings. eval_eq_packed is 4.92% spread across ~20 rounds (0.25%/call); marginal fold savings per call are below noise floor. Revert de661734.
7	h12	-4.0	-1.33	—	keep	3	Blake3 internal Merkle node compression: replace Poseidon-16 for all tree levels. Arnon/Chiesa/Fenzi/Yogev 2024/1586 §1,§6.1 + O'Connor/Aumasson/Neves/Wilcox-O'Hearn 2021 (BLAKE3) §2.5,§3. Cross-crate: symetric (from_first_layer_with_fn), whir (prover+verifier), fiat-shamir (proof restoration). Inspiration: h6 extended to full tree.	Δ=-1.33% p=0.0 (t=-8.526). Criterion vs origin/main: -15.17%. Prediction -4% overestimated — profile's 7% Poseidon compression included Fiat-Shamir permute_mut, not just Merkle internal nodes. Packed Poseidon (16-wide SIMD) amortized compression cost more than anticipated. Blake3 serialization overhead (16 to_unique_u32 per internal node) is non-trivial. Net: internal compression dropped from ~4-5% to ~1% of total. Commit c778ef43.
8	h8	-3.0	+0.41	—	discard	1	Incremental eq fold in run_phase1_sumcheck + quotient_sumcheck_prove_packed_br_base: replace per-round eval_eq_packed recomputation with additive fold eq_new[i]=eq_old[i]+eq_old[i+half]. Thaler 2013 §3.2 — summing over removed variable cancels factor. Applied to both br_base rounds 0→1 and while loop.	Δ=+0.41% p=0.124 (noise). eval_eq_packed profile attribution of 2.84% likely inflated by 16.4% perf sample loss. Addition-based fold is mathematically correct (correctness passed) but the absolute runtime cost of eval_eq_packed is too small to produce a measurable signal. Binary recursion's cache-friendly sequential access pattern may also compete favorably with stride-half fold pattern. Both h11 (wrong fold, iter 6) and h8 (correct fold, iter 8) null — eval_eq_packed is NOT the bottleneck. Revert 296f4f49.
9	h15	-1.5	-0.59	—	discard	3	Blake3-based Fiat-Shamir sponge: replace Poseidon-16 permute_mut in challenger with Blake3 XOF. Created Blake3Permutation implementing Permutation for scalar + packed KoalaBear. Updated utils/wrappers.rs. Profile: permute_mut = 1.85%.	Δ=-0.59% p=0.001 (t=-3.762). Signal IS real but below -1.0% keep threshold. Poseidon permute_mut at 1.85% was partially inflated (perf sample loss). Blake3 XOF + to_unique_u32 serialization + from_le_bytes reconstruction has ~132 cycle overhead vs ~2000 for Poseidon-16 — but actual savings only 0.59% of 9s total. Indicates Poseidon for Fiat-Shamir is ~0.6-0.8% of actual runtime (not 1.85%). Revert f4ecc6b3.
12	10	h17	-5.0	+52.34	—	discard	2	Degree-3 Poseidon AIR via single-round checkpointing: replace 2-round blocks (degree 9→10) with per-round checkpoints (degree 3). Columns 109→189, eval points 10→3. Grassi et al. 2021/1167 §5.1-5.2 degree-vs-column tradeoff + Thaler 2013/351 §3.1 sumcheck eval count = degree+1.	Δ=+52.34% p=0.0 (t=54.405). CATASTROPHIC. 80 new columns (109→189) increased TOTAL trace from 166→246 cols (+48%). Poseidon dominates total col count (69% of baseline). Every trace-width-dependent operation (DFT, Merkle commit, fold, memory) scales linearly with total cols. The ~48% trace width increase matches the ~52% regression almost exactly. AIR sumcheck eval-point savings (~8%) completely overwhelmed by trace-width costs. CRITICAL LEARNING: degree-vs-column tradeoff ONLY helps when the target table is a SMALL fraction of total trace. Poseidon at 69% of columns makes width increases catastrophic. Revert 1cf91bf2.
13	11	h22	-2.0	-0.24	—	discard	3	In-place multilinear fold for AIR sumcheck: after round 0 (base→ext type change), fold extension→extension in-place instead of allocating new Vec per column per round. Sequential within each column (output idx < input idx), par_iter_mut across ~166 columns. Thaler 2013/351 §3.2 + Setty 2020/1618 §4.1.	Δ=-0.24% p=0.266 (noise). Allocator's thread-local free list recycles exact-sized chunks from the previous round's deallocation, so uninitialized_vec returns already-mapped, TLB-warm pages — allocation overhead is ~0 when the alloc/free pattern is warm (prove_loop steady-state). Cache locality gain also negligible: the fold writes all elements of the new buffer immediately, so the allocator's fresh pages fault in sequentially regardless of in-place vs out-of-place. Page fault overhead prediction was wrong — glibc mmap threshold (128KB) means large allocs use mmap, but the mmap'd pages from the just-freed buffer are likely returned to the same virtual range by the kernel (MAP_PRIVATE + MADV_FREE). Revert e68d1640.
12	h23	-2.0	-1.06	—	keep	1	Remove 16 trivially-zero Poseidon output constraints: flag_permute ≡ 0 in production (no program uses poseidon16_permute). Remove 8 flag_permute*(state-outputs_left) + 8 flag_permute*(state-outputs_right). Simplify first 4 compression constraints from degree 10 (not_permute * expr) to degree 9 (expr). n_constraints 99→83. Arnon/Chiesa/Fenzi/Yogev 2024/1586 §6.1 constraint-count/degree tradeoff.	Δ=-1.06% p=0.0 (t=-9.871). Ship-gate -15.69% vs origin/main (Criterion). Prediction -2.0% overestimated — removing 16 constraints from 99 reduces AIR eval work by ~16%, but AIR eval is only ~15% of total, and not all constraint-eval time is proportional to count (the MDS+cube rounds dominate). Net: ~2.5% of 15% ≈ 0.4% theoretical floor; measured 1.06% suggests degree-9 simplification also saves skip-eval work (4 fewer degree-10 constraints → 4 fewer full eval points needed if low_degree threshold shifts). Commit dcb4e0ca.
13	h24	-30.0	-0.32	—	discard	1	Disable glibc heap trimming via mallopt(M_TRIM_THRESHOLD,-1) + mallopt(M_MMAP_THRESHOLD,MAX) to eliminate MADV_DONTNEED page fault cycling. Standalone test: page faults 200x reduction, sys time 5x reduction, 32% wall-clock improvement. whir/utils.rs configure_allocator_for_proving() called from precompute_dft_twiddles.	Δ=-0.32% p=0.133 (noise). eval_paired.sh builds with --features zkalloc_global, which sets zk-alloc as #[global_allocator]. mallopt configures glibc's allocator, not zk-alloc — the call is a no-op when zk-alloc handles allocations. The 32% standalone improvement (glibc → glibc+mallopt) is real but irrelevant to the benchmark. CRITICAL LEARNING: always profile with the ACTUAL benchmark binary (zk-alloc enabled), not the default build. Revert 0bd12dd2.14	h28	-1.3	-1.37	—	keep	1	Eliminate flag_half_output gate: remove (1-flag_half_output) multiplicative gate from 4 output constraints (i∈{4..7}) in eval_last_2_full_rounds_16. Lowers degree_air 10→9, reducing skip-eval points from 6 to 5. Grassi et al. 2021/1167 §5.1 degree-vs-eval tradeoff + Thaler 2013/351 §3.1 (eval count = degree+1). Verified trace_gen.rs:162 already fills outputs_left = state+inputs for all rows.	Δ=-1.37% p=0.0 (t=-8.169). Ship-gate -16.56% vs origin/main (Criterion). Prediction -1.3% → measured -1.37% — excellent accuracy. Degree 10→9 saves 63 eval-units/round (8.87% of AIR eval). Effective share-arithmetic: 14.7% × 8.87% = 1.30% predicted, 1.37% measured (delta from non-AIR speedup from polynomial interpolation with fewer points). Commit 2d2af5ab.
15	h30	-25.0	+5.89	—	discard	16	GKR-based Poseidon verification: replace degree-9 AIR (109 committed cols, 83 constraints) with GKR interactive proof (degree-2, 25 committed cols, 7 constraints). poseidon_gkr crate (prove/verify/witness_gen/gkr_layers ~700 lines), modified poseidon_16/mod.rs, prove/verify_execution.rs, stacked_pcs.rs. WIP arc: 2 commits.	Δ=+5.89% p=0.0 (t=39.028). REGRESSION. Primary failure: stacked_n_vars stayed at 26 (predicted 25). 25 committed cols → 37.9M total > 2^25; only ≤8 cols would drop n_vars. The predicted -15% from halved DFT/Merkle was entirely lost. AIR degree 10→7 saved ~4-5% but GKR overhead dominated: 464-column witness gen (29 layers × 16 cols × 2^18 rows ≈ 476MB allocation), 28 sumcheck rounds, 8 MLE evaluations for perm_out. Share-arithmetic failure: -15%(DFT/Merkle) + -13%(AIR) + 3%(GKR overhead) predicted, actual 0%(DFT/Merkle) + -5%(AIR) + 11%(GKR) = +6%. CRITICAL LEARNING: GKR tradeoff only wins when committed column reduction crosses a power-of-2 threshold for stacked_n_vars. At 25 committed cols, the offset shrinks but n_vars stays the same — DFT/Merkle work unchanged. Revert 486d90de + c374e468.
16	h31	-4.0	-4.03	—	keep	3	Remove 8 dead outputs_right columns from Poseidon-16 table: flag_permute ≡ 0 ⇒ outputs_right always zero, never read by lookup. Column count 109→101, total trace 158→150 cols. Narrow 4th lookup (16→8 values). Arnon/Chiesa/Fenzi/Yogev 2024/1586 §6.1 + dead-store elimination.	Δ=-4.03% p=0.0 (t=-29.248). Ship-gate -19.64% vs origin/main (Criterion). Prediction -4.0% → measured -4.03% — near-perfect accuracy. 8/158 cols = 5.06% trace-width reduction. Linear cost savings: DFT (encode ~38%), Merkle commit (~18%), fold (~12%), memory (~8%). Total predicted: 0.76×5.06% ≈ 3.85% — measured 4.03% slightly higher due to improved cache utilization (narrower trace fits better in L2 per-row). Noise floor 0.43%. Commit e084e144.
17	h35	-3.0	+4.98	—	discard	2	Fuse partial-round pairs: remove 10 of 20 s0 checkpoint columns (101→91 Poseidon cols, 150→140 total). Pair degree-9 constraints (cube(cube(state))) within degree_air=9. Remove low_degree_block skip optimization. Grassi et al. 2021/1167 §5.1 + Thaler 2013/351 §3.2.	Δ=+4.98% p=0.0 (t=22.556). REGRESSION. The low_degree_block skip optimization is far more valuable than estimated. Currently: 20 partial round constraints evaluated at 4 points (degree 3), with entire block SKIPPED at the remaining 6 high-degree points (just cached state memcpy). After fusion: 10 degree-9 constraints evaluated at ALL 10 points — the state evolution through 2 cubes+2 sparse_MDS runs 2.5× more often. Column savings (-5.1%) overwhelmed by constraint eval overhead (+10%): the skip saves not just assertions but the FULL state computation (16-wide sparse matrix multiplies) at 6/10 eval points. CRITICAL LEARNING: the low_degree_block mechanism makes partial round checkpoints LOAD-BEARING for performance despite appearing wasteful. Any future column reduction from partial rounds must preserve the skip structure or find equivalent amortization. Revert 56005b93.
18	h36	-2.0	-0.91	—	discard	1	Skip zero_vec in combine_statement when first OOD statement initializes full array: detect selector=0 + inner_n_vars==num_variables, use uninitialized buffer + INITIALIZED=false in eval_eq (STORE vs ADD path). 1.28GB array, saves memset+read. Plumber+Srinivasan 2017 lazy-init + Fog 2024 §9.11 streaming stores.	Δ=-0.91% p=8.9e-05 (t=-4.43). Below -1.0% keep threshold. Analysis: Linux mmap(MAP_ANONYMOUS) already provides lazy zero pages — physical memset cost negligible. Real savings from eliminating 1.28GB reads (ADD→STORE in leaf writes), but eval_eq is compute-bound in recursive middle (16 muls+adds per level), not memory-bound at leaves. Total combine_statement=363ms; savings ~15ms. LEARNING: memory-bandwidth optimizations on WHIR initial sumcheck give diminishing returns because the bottleneck is compute (packed field arithmetic in eval_eq recursion), not memory access. The 1.28GB array looks like a bandwidth target but pages are hot from the prior proof. Revert 15840aef.
19	h37+h36b	-1.0	-1.39	—	keep	1	WIP arc: zero-alloc blake3 leaf hashing (transmute KoalaBear→u8 + 4KB stack buffer for padding) + combine_statement zero_vec skip (uninitialized_vec + compute_eval_eq_packed STORE path when first OOD statement covers full array). Eliminates ~1M per-proof heap allocations in Merkle leaf hashing and 1.28GB memset in combine_statement. Blake3 leaf: row_bytes via from_raw_parts, stack-alloc for padding<4KB. Blake3 compress: transmute-cast digests to &[u8;32]. Combine: detect selector=0 + inner_n_vars==num_variables → skip zero_vec, use uninitialized buffer.	Δ=-1.39% p=1e-06 (t=-7.342). Ship-gate -24.88% vs origin/main (Criterion). Noise floor 0.22%. Both sub-threshold individually (blake3 ~0.5%, zero_vec ~0.9%) but cross -1.0% when bundled. Prediction -1.0% → measured -1.39% (bundling synergy from reduced allocator pressure benefiting both paths). Commit c106f77b.
20	h40	-0.9	+0.34	—	discard	1	Move 7 metadata constraints (bool checks + flag interaction) into low_degree_block to skip at 5 high eval points. Low-degree-air count 20→27. Grassi 2021/1167 §5.1 + Thaler 2013/351 §3.1.	Δ=+0.34% p>0.1 (noise). 7 degree-2 constraints skipped at 5 points saves only 35 EFPacking×IF mults per packed-pair — too small vs overhead of accumulator_low tracking at 4 full points. h38 killed during Phase 2: MDS batching replaces cheap IF×F butterflies (~34/pair) with expensive EFPacking×IF mults (~32/pair), net cost INCREASE. Need completely different direction.
21	h42	-5.0	—	—	discard	1	Factored eq construction in combine_statement: compute eq over n-1 vars then expand by s0/s1 for lo/hi halves. Splits MSB variable out of eq polynomial to save half the recursive doubling. Mathematically sound but compute_eval_eq_packed uses 3-part split with fill_buffer processing first LOG_NUM_THREADS vars in REVERSE order — variable-to-index mapping differs from simple MSB-first. Proof verification fails (InvalidProof). Variable ordering in packed parallel eq construction too complex to factor simply.	Verification failure. compute_eval_eq_packed internal variable ordering (3-part split: packed tail, reversed fill_buffer head, recursive middle) means point[0] does NOT correspond to lo/hi array split. Would need full reverse-engineering of the variable↔index bijection to correctly factor. Complexity exceeds value — revert 97338e4f. LEARNING: the parallel packed eq construction in this codebase has non-trivial variable ordering that prevents naive algebraic factoring. Any optimization targeting eq polynomial structure must respect the 3-part split semantics.
22	h42-fix	0	0	—	keep	0	Fix verification failure introduced by pw5-14 (iter 14). Restore flag_half_output gate on Poseidon output constraints i>=4. pw5-14 incorrectly removed gate claiming trace_gen fills outputs_left for ALL rows; in reality trace_gen.rs post-processing overrides outputs_left[4..8] with memory values for half_output rows. Restores degree_air=10 (was incorrectly 9 since iter 14). All iterations since iter 14 ran with broken verifier — performance measurements remain valid since verifier is not in the hot path.	Bug discovered during h42 investigation. Root cause: flag_half_output gates are NEEDED because in half_output mode, outputs_left[4..8] are overridden with memory lookup values (trace_gen.rs:130-132), not the Poseidon output state. The ungated constraint asserts state[i]+inputs[i]==memory_value which is false. Ship gate confirms -25.49% vs origin/main (Criterion: -24.65%). Commit 533f5a35.

23	h43	-5.0	-24.6	—	keep	9	Reduce Poseidon16 degree_air from 10 to 9 via conditional lookups. Replace flag-gated output constraints with conditional memory lookups (inactive when flag_permute=1 or flag_half_output=1). Eliminates degree-10 products from AIR. LookupIntoMemory.conditional_inactive: Option→Vec<ColIndex>. Logup uses 1-sum(flags) for mutually-exclusive booleans. total_whir_statements fixed to count conditional columns.	Δ=-24.6% p=0.00 (Criterion). Ship-gate: confirmed improved. Core mechanism: WHIR PCS verifier cost scales with max_degree in sumcheck — degree 10→9 reduces the number of evaluation points in the AIR sumcheck by 1 (from 11 to 10), saving ~9% of sumcheck work per round. Combined with fewer constraint evaluations (removed flag-gated terms), this delivers outsized throughput gain. Commit 8cab7a36.
24	h44	-5.0	+57.9	—	discard	2	Split Poseidon16 full-round pairs into single-round constraints (degree 9→3). Added 64 intermediate witness columns to reduce eval points from 9 to 3. The extra columns dramatically increased stacked PCS polynomial size and WHIR commitment cost, outweighing the per-eval-point savings.	Δ=+57.9% massive regression. The 64 additional columns (101→165) inflated the stacked polynomial beyond the 2^26 boundary, adding extra WHIR rounds. Column-loading memory bandwidth also increased proportionally. The degree-split mechanism (4 full + 5 skip) was already highly efficient — the skip evaluations are cheap (just state copy + post-block computation), making the 9→3 reduction much less valuable than predicted. LEARNING: adding witness columns to reduce degree is only profitable when the column count increase keeps stacked_n_vars unchanged AND the degree reduction eliminates more work than the extra columns add in memory traffic and PCS cost. Revert 4be854ff.
25	h42b	-3.0	-2.54	339	keep	2	Fused dual-point eq computation in combine_statement: process both full-domain eq polynomials (memory OOD + public_memory) in a single recursive pass. compute_eval_eq_packed_dual carries two scalar chains through one tree traversal, writing eq_a + eq_b at leaves. Eliminates one 1.28GB DRAM round-trip where second eq previously read-modified-wrote full buffer from cold DRAM.	Delta=-2.54% p=0.0 (t=-16.935). Noise floor 0.35%. Tracing: combine_statement 186ms->135ms (-51ms). Mechanism: two full-domain eq evaluations (selector=0, inner_nvars=26) previously required 2 passes over 1.28GB buffer (init + add). Dual recursion fuses into 1 pass. Extra computation (4 mults/level vs 2) negligible (~1ms) vs bandwidth savings (~48ms). Commit 9b41c208.
26	h45	-3.0	+21.62	—	discard	2	On-the-fly eq weight evaluation with tiling: eliminate 1.28GB weight buffer DRAM reads in product sumcheck rounds 1 and 2 by computing eq weights per-tile during the round polynomial accumulation. Factorizes eq into outer (EF scalars per tile, 160KB L2-cached inner table, lane factor). Scatter regions handle residual statement weights.	Delta=+21.62% massive regression. The computational overhead of on-the-fly eq evaluation (extra multiplications per position) exceeds the saved DRAM bandwidth. Zen 4 DDR5 at ~50GB/s reads the 1.28GB buffer in ~25ms per round, but the tiled computation adds ~350ms of arithmetic per round. LEARNING: for this system, the product sumcheck is NOT purely memory-bound — the per-element compute cost of reconstructing eq weights dominates over buffer streaming. The standard precomputed buffer approach is near-optimal; further improvement must come from reducing the NUMBER of rounds or the BUFFER SIZE, not from eliminating individual reads.
