iter	hypothesis_id	predicted_pct	measured_pct	proof_kib	status	files_changed	rationale	diagnostic
27	h46	-2.7	—	—	discard	2	Remove 5 dead Poseidon-16 metadata columns (flag_permute, flag_half_output, flag_hardcoded_left, offset_hardcoded_left, effective_index_left_second) to reduce committed columns 101→96.	DISCARD: premise invalid. XMSS bytecode uses half_output and hardcoded_left modes via compiler optimization (poseidon16_compress_half_hardcoded_left). Only flag_permute is truly dead. Removing 1 column from 101→100 yields ~0.55% which is below noise. LEARNING: always instrument the runtime to verify which bytecode precompile modes are actually exercised before removing flag columns. Static source analysis (grep for function names) misses compiler-level specializations.
28	h48	-0.6	-0.6	—	discard	—	Sub-threshold measurement	Below -1.0% keep threshold
29	h49	-0.27	-0.27	—	discard	—	Sub-threshold measurement	Below -1.0% keep threshold
30	h50	-1.2	+1.06	—	discard	—	Move AIR sumcheck data prep before logup/GKR phase	Regression — data prep reordering hurt cache locality
31	h51	-21.0	—	—	discard	—	Reduce logup entry count by batching contiguous memory lookups	Premise investigation — not implemented
32	h52	-0.57	-0.57	—	discard	1	Sub-threshold measurement	Below gate threshold
33	h58	-5.0	+58.72	—	discard	2	Column-widening attempt — massive regression	Same trace-width catastrophe pattern as h17/h44
34	h60	-2.0	+0.55	—	discard	1	Discard — noise	Below gate threshold
35	h65	-2.0	+0.55	—	discard	1	Promote nu_a/b/c to committed execution cols (degree 5→3, +3 cols)	Max sumcheck degree unchanged (poseidon_16 degree=9 dominates), no benefit. 3 extra columns added cost.
36	h72	-3.8	+0.16	—	discard	1	Pre-fault arena pages via madvise(MADV_POPULATE_WRITE)	No effect — MADV_POPULATE_WRITE serialized, not parallelizable
37	h68	-1.5	-1.18	—	keep	3	WIP arc: packed SIMD first-round product sumcheck + skip redundant zero-fill + parallel column stacking	Δ=-1.18% — bundled sub-threshold changes crossed gate
38	h78	-1.5	-0.46	—	discard	1	Parallel zero-fill in combine_statement (rayon par_chunks_mut)	Δ=-0.46% p=0.116 — serial zero_vec page faults already amortized
39	h81	-5.0	+0.13	—	discard	1	with_min_len(1024/512) on DFT butterfly + logup inner par_iter	Noise — wrong prediction from perf self-time attribution
40	h83	-1.5	-0.5	—	discard	1	Parallel memory and bytecode accumulator construction (AtomicU32 scatter-add)	Δ=-0.5% p=0.014 — below -1.0% keep threshold
41	h85	-3.0	+0.23	—	discard	1	Unknown hypothesis — data partially recovered	Noise
42	h87	-1.5	+5.94	—	discard	2	Karatsuba 3+2 split quintic extension field multiply	14 standalone muls + 55 adds vs schoolbook 25 muls — regression from instruction-level overhead
43	h93	-3.0	-0.27	—	discard	1	Factored dual-point eq materialization	Δ=-0.27% — sub-threshold
