iter	hyp_id	predicted_pct	measured_pct	proof_kib	status	files_changed	rationale	diagnostic
1	h1	-4.0	-7.68	-0.86%	keep	poseidon1_koalabear_16.rs,poseidon/mod.rs	Reduce R_P=20→14 (ePrint 2019/458 §5.4, 2026/150 Table 3, 2025/950 §4.2). CICO-8=2^166.9. Grain LFSR regen via Plonky3 script. Steady-state: base=2.208s cand=2.039s t=-89.5 p=0.0	n/a
2	h2	-5.0	-2.17	tbd	keep	poseidon1_koalabear_16.rs,poseidon/mod.rs,trace_gen.rs	Reduce R_F=8→6 with R_P=16 (total R=22). CICO-8=2^144.3. AIR restructured: single rounds in low_degree_block. Steady-state: base=2.035s cand=1.991s t=-22.5 p=0.0. Cumulative -9.83% vs origin	n/a
3	h4	-1.5	-4.86	tbd	keep	poseidon1_koalabear_16.rs	Reduce R_P=16→14 with R_F=6 (total R=20). CICO-8=2^137.9. Grain LFSR regen. Steady-state: base=1.993s cand=1.896s t=-42.4 p=0.0. Cumulative -14.13% vs origin	n/a
4	h4	-1.0	-0.74	+0.05%	discard	poseidon1_koalabear_16.rs	Reduce R_P=14→13 with R_F=6 (total R=19). CICO-8=2^134.7. Paired: base=1.832s cand=1.818s t=-4.5 p=0.0002. Delta -0.74% < -1.0% threshold → DISCARD. git revert.	Diminishing returns: 1 partial round saves only 0.74% — below noise/threshold. Round reduction mechanism exhausted at R_F=6, R_P=14.
5	h5	-2.8	-1.89	tbd	keep	lean_prover/src/lib.rs	Enable CapacityBound soundness (ePrint 2024/1586 Thm 5.2) + max_send=10. Paired: base=1.833s cand=1.798s t=-9.07 p=0.0. Cumulative -18.57% vs origin (2.208s→1.798s). TARGET EXCEEDED.	n/a
6	h6	-2.1	+3.59	tbd	discard	poseidon/mod.rs,trace_gen.rs	Add 16 last_round_state columns to reduce AIR degree 10→9. REGRESSION: +16 cols increased Merkle cost more than sumcheck savings. Paired: base=1.785s cand=1.849s t=+22.4 p=0.0. git revert.	Column-degree tradeoff went wrong: 16 extra cols × 2^18 rows = 4.2M extra cells in stacked PCS, increasing commitment cost by ~3.6% while sumcheck saved only ~1.5%.
7	h7	-3.0	-3.21	+20%	discard	lean_prover/src/lib.rs	RS_DOMAIN_INITIAL_REDUCTION_FACTOR 5→6. Paired: base=1.787s cand=1.729s t=-26.9 p=0.0. Delta -3.21% BUT proof size penalty triggered (proof grew ~20%). Net score below threshold. git revert.	Proving speed improved -3.21% but proof size grew unacceptably. The higher RS rate at round 1 requires more WHIR queries, inflating proof size beyond the penalty threshold.
8	h7+	-3.0	+0.82	+5%	discard	lean_prover/src/lib.rs	RS_DOMAIN_INITIAL_REDUCTION=6 + GRINDING_BITS=20. Proof size acceptable (+5.17%) but speed regressed +0.82%. The extra grinding (16×) ate all the RS reduction savings. Paired: base=1.786s cand=1.801s.	Speed/proof-size tradeoff not achievable: RS reduction gains speed but costs proof size; grinding fixes proof size but costs speed. Net zero.
