iter	hypothesis_id	predicted_pct	measured_pct	proof_kib	status	files_changed	rationale	diagnostic
1	h1	-25	+10.67	-	discard	product_computation.rs,open.rs	SplitEq factored eq for WHIR product sumcheck round 0 (eprint 2025/1117 Sec 3, eprint 2024/1210 Sec 3). Replaced full 2^n eq table materialization with per-point SplitEq reconstruction.	WRONG DIRECTION. SplitEq::get_packed does 1 EFPacking multiply per call. With 2 terms + sparse, inner loop does ~8 EFPacking muls per element (2x w_lo + 2x w_hi). Original code does 1 flat read per element after cheap O(2^n) recursive fill. On M4 NEON the bottleneck is compute throughput not memory bandwidth (IPC=4.33 serial). The factored approach trades cheap memory reads for expensive on-the-fly EFPacking multiplies — net negative. Kill condition should have included: verify compute_eval_eq_packed_dual per-element cost < SplitEq::get_packed per-element cost. DO NOT REATTEMPT SplitEq-based factoring for the product sumcheck weights — the per-element reconstruction cost exceeds flat-table access.
2	h5	-5	-0.02	-	discard	product_computation.rs	Delayed-reduction base×ext sumcheck kernel for round 0 (eprint 2025/1117 Sec 4, Plonky3 strategy.rs). Activated dead-code compute_product_sumcheck_polynomial_base_ext_packed replacing sumcheck_quadratic with u128/i128 accumulators.	NO EFFECT. The dead code processes lanes sequentially (for lane in 0..PF::WIDTH) with scalar u64 arithmetic, forfeiting NEON SIMD parallelism. The packed sumcheck_quadratic uses NEON to process all 4 lanes simultaneously. Montgomery reduction savings per lane are cancelled by the 4x throughput loss from scalar-vs-packed operation. On M4 NEON, packed quintic_mul already amortizes Montgomery cost across 4 lanes. DO NOT REATTEMPT scalar delayed-reduction for the product sumcheck — must use NEON-vectorized delayed reduction (e.g. via widening u32×u32→u64 NEON intrinsics) to beat the packed path.
3	h6	-7	+19.15	-	discard	eq_mle.rs,open.rs	Fused eq-table generation + round-0 sumcheck dot product (eprint 2025/1117 Sec 5, eprint 2023/1284 Sec 3). Paired lo/hi thread chunks to generate eq weights and immediately compute sumcheck c0/c2 coefficients, eliminating second pass over 1.34 GiB weight table.	WRONG DIRECTION. Halving thread parallelism (16→8 tasks, each doing lo+hi pair) caused ~2x per-task work with only half the thread utilization. On M4 with 10 cores, 8 tasks severely underutilizes the hardware. The dot product add-on per task further increases wall-clock. The original two-pass approach uses full 16-task parallelism for eq generation AND full par_iter parallelism for the dot product — both passes are individually better parallelized. The "saved" second DRAM pass is dominated by the lost thread parallelism. DO NOT REATTEMPT lo/hi thread pairing — cache locality gain is negligible on this scale (40 MiB per chunk >> L2 192 KB) and thread utilization loss is catastrophic. True fusion requires interleaving dot product inside the recursive eq descent itself, not post-hoc pairing.
4	h10	-20	+7.4	-	discard	eq_mle.rs	Iterative level-by-level eq table doubling replacing recursive binary descent (FOCS 1999, eprint 2025/1117 Sec 3.2). Sequential memory access via ping-pong buffers for two separate eq polynomial arrays.	WRONG DIRECTION. Iterative approach has 12× more memory traffic than recursive. Recursive carries scalars in registers (zero reads, each output written once = 335 MiB). Iterative reads+writes entire growing array at each of 22 levels = ~4 GiB per polynomial. Sequential access does NOT compensate for 12× bandwidth increase. M4 write-combining handles recursive writes well. DO NOT REATTEMPT iterative eq construction — recursive is fundamentally superior due to register-carried scalars.
5	h11	-30	-0.07	-	discard	product_computation.rs,open.rs	Factored eq polynomial with tiled product sumcheck (eprint 2026/587 Sec 3, eprint 2023/1284 Sec 3.1). Split eq(z,x) = eq_top(z_top,x_top) × eq_bot(z_bot,x_bot) with k=7 matching initial folding factor. Replaced compute_eval_eq_packed_dual with factored eq_top (128 EF entries) + eq_bot (2^17 packed entries) + corrections table for sparse statements.	NO EFFECT. Three compounding problems: (1) corrections table must be full-size (2^24 packed entries = 320 MiB) because sparse statements (memory_acc with inner_num_vars=24) fill nearly the entire weight table — no memory saving; (2) materialize_and_fold_factored after round 0 costs 2^23 × 50 packed muls = 420M (as expensive as original eq generation); (3) factored round-0 inner loop at 64 × 2^17 × 30 packed muls = 250M adds on top. Net compute: ~1.5B packed muls vs original ~500M. The factored approach only wins when corrections are genuinely sparse (few non-OOD statements, small inner_num_vars). DO NOT REATTEMPT factored eq on this codebase — the stacked PCS generates corrections spanning half the weight table.
6	h9	-4	+0.59	-	discard	air_sumcheck.rs	Parallel batched AIR sumcheck across tables (eprint 2025/1117 Sec 5, eprint 2019/550 Sec 6). Changed compute_bare_round_poly to &self, added Send+Sync to trait, used par_iter on active sessions.	WRONG DIRECTION. +0.59% (p=0.053). The inner par_iter in compute_raw_poly_degree_split already saturates all cores for each session. Running 3 sessions concurrently via par_iter adds rayon task scheduling overhead (spawn+join for 3 trivial items) and causes thread contention with the inner parallelism. The 4/10 core utilization is averaged across sequential phases (Fiat-Shamir, eq setup, folding) — during the hot compute_raw_poly loop, cores ARE saturated. Cross-session parallelism is counterproductive when inner-session parallelism already uses all cores. DO NOT REATTEMPT outer-level table parallelism — the bottleneck is intra-session compute throughput, not inter-session scheduling.
7	h25	-6.5	+0.53	-	discard	poseidon1_koalabear_16.rs,sponge.rs,permutation.rs,merkle.rs	Interleaved 2x Poseidon sponge chains for Merkle leaf hashing (eprint 2009/442 Sec 3, Poseidon paper eprint 2019/458 Sec 5). Round-level interleaving of two packed permutations.	WRONG DIRECTION. M4 Pro 32 NEON 128-bit registers fully utilized by single permutation (16 PackedKB state values). 2x interleaving requires 32 values, causing register spills. Existing InternalLayer16 split already provides adequate ILP between S-box and dot-product paths.
8	h27	-1.7	+0.22	-	discard	dft.rs	LAYERS_PER_GROUP=4 quad-layer DFT butterfly (Harvey JSC 2009 §4.2, Bernstein eprint 2009/442 §3). 16-sub-block parallel pass reducing full-matrix passes from 6 to 4.	NO EFFECT. delta=+0.22%, p=0.30. The 15-way zip and larger rayon work items in the quad-layer pass add scheduling overhead that offsets the memory pass reduction. The existing LAYERS_PER_GROUP=3 is already a good tradeoff between pass count and per-pass overhead. DO NOT REATTEMPT higher LAYERS_PER_GROUP — diminishing returns from batching more layers per pass.
9	h38	-2.5	+0.14	-	discard	air_sumcheck.rs	Row-major (AoS) column layout for AIR sumcheck inner loop (eprint 2024/1539 §3.2, cache-coalesced access). Transposed SoA columns to contiguous row-major buffer before par_iter.	NO EFFECT. Clean measurement: delta=+0.14%, p=0.54, noise_floor=0.25% (reliable). The O(n*n_cols) transpose cost (~184MB allocation+copy per round) exceeds any cache locality benefit. The existing SoA access pattern with rayon's sequential par_iter already achieves good locality: consecutive new_j values access the same chunk (2^fold_bit elements) of each column, fitting in L2. The scattered 22-column loads are not the bottleneck — each column pointer dereference is a single indexed load that the hardware prefetcher handles. DO NOT REATTEMPT SoA→AoS transpose for AIR sumcheck — the transpose overhead dominates.
10	h39	-1.5	-0.02	-	discard	field.rs,packed_extension.rs,product_computation.rs	Delayed Montgomery reduction via tiled mixed_dot_product in product sumcheck (Plonky3 PR#1597 478d2b47, Harvey JSC 2014 §2.3). Added mixed_dot_product<8> to Algebra trait, overrode for PackedQuinticExtensionField with coordinate-wise D=5 base-level dot_product::<8> calls. Tiled compute_product_sumcheck_polynomial in K=8 chunks.	NO EFFECT. delta=-0.02%, p=0.94, noise_floor=0.36% (reliable). The product sumcheck inner loop is MEMORY-BANDWIDTH BOUND, not compute-bound on Montgomery reductions. With 2×1.28GB (evals+weights) per round, the M4 Pro memory subsystem is the bottleneck. The NEON delayed-reduction primitive saves ~6 instructions per K=8 tile (reducing 8 Montgomery reductions to 1), but the loop is stalled on cache misses, not ALU throughput. The Plonky3 -28% kernel result was on a microbenchmark fitting in cache; at 2^24 packed elements the working set far exceeds all cache levels. DO NOT REATTEMPT delayed-reduction tiling for the product sumcheck at this data scale — the bottleneck is DRAM bandwidth, not ALU.
11	h40	-2.0	+0.54	-	discard	product_computation.rs,open.rs	Fused combine_statement + product sumcheck round 0 for cache-warm weight access (eprint 2025/1117 Sec 5, eprint 2024/1210 Sec 3.1). Computed round-0 c0/c2 immediately after eq weight generation while 1.28GB table is cache-warm, passed pre-computed polynomial to run_product_sumcheck_with_round0.	NO EFFECT. delta=+0.54%, p=0.067, noise_floor=0.22% (reliable). The 1.28GB weight table (2^24 packed EFPacking entries) far exceeds all M4 Pro cache levels (192KB L2, 48MB shared L3). Even immediate access after generation is DRAM-bound — there is no cache warmth to exploit at this scale. The round-0 computation by itself is ~40ms and already efficient. DO NOT REATTEMPT cache-locality fusion for the product sumcheck at 2^24+ scale — the working set is fundamentally DRAM-resident.

12	h44	-6.4	-9.56	-	keep	poseidon/mod.rs,table_enum.rs,air/lib.rs,stacked_pcs.rs,air_sumcheck.rs,compilation.rs,recursion.py	Virtual Poseidon intermediate columns (eprint 2025/2041 Sec 5.2, eprint 2020/315 Sec 3.2). Reordered Poseidon1Cols16 struct: 41 committed columns (9 control + 16 inputs + 16 outputs) first, 68 virtual intermediates (32 beginning_full_rounds + 20 partial_rounds + 16 ending_full_rounds) after. Added n_committed_columns() to Air trait. Stacked PCS uses committed-only count, reducing offset from 59.9M to ~42M. WHIR claims only include committed columns. Recursion circuit updated with N_COMMITTED_AIR_COLUMNS.	KEEP. delta=-9.56%, p=0.0, t=-46.16, df=34.6. Consistent across all 5 rounds (-9.08% to -9.97%). Baseline: 2.3205s, Candidate: 2.0987s. Savings of 222ms per proof — exceeds predicted -6.4% by 50%. The extra savings likely come from: (1) reduced WHIR product sumcheck working set (fewer statements → smaller eq polynomial); (2) reduced DFT matrix width; (3) fewer Merkle leaf hash permutations.

13	h47	-5.0	+0.51	-	discard	poseidon/mod.rs,poseidon/trace_gen.rs	Mid-round checkpoints for Poseidon degree reduction 10→4 (eprint 2025/2041 Sec 5.2, Thaler PArgZK 2022 Sec 4.6.2). Split eval_2_full_rounds_16 into eval_1_full_round_16 pairs with virtual mid-round checkpoints. degree_air 10→4, eliminating 6 skip eval points per pair.	NO EFFECT. delta=+0.51%, p=0.11, noise_floor=0.87% (unreliable). Adding 64 virtual checkpoint columns (4 blocks × 16) increased n_columns from 109 to 173, adding 64 multilinear reads per pair per eval point. The degree reduction from 10→4 eliminates 6 skip points (savings: 6×1030=6180 muls/pair) but the 64 extra column reads at ALL 4 full points add cache pressure (64 cols × 2^10 packed entries = 1.28MB extra per iteration vs 192KB L2). Net: memory bandwidth cost of extra columns offsets the ALU savings from fewer eval points. The degree-split optimization (skip points via Lagrange interpolation from cached state) was already optimal — it AVOIDS reading full-column data at skip points, which is cheaper than reading more columns at fewer points. DO NOT REATTEMPT degree reduction via extra virtual columns — the column read overhead cancels ALU savings at this data scale.

14	h48	-15.1	-29.26	-	keep	execution/air.rs,stacked_pcs.rs,compilation.rs,recursion.py	Virtual execution instruction columns — nv 26→25 (eprint 2025/2041 Sec 5.2, eprint 2023/552 Sec 3.1). Override n_committed_columns()=8 for ExecutionTable (runtime cols only). Instruction columns (8-19) excluded from stacked PCS but constrained by LOGUP bus fingerprint against known bytecode polynomial. Filter stacked_pcs_global_statements and total_whir_statements to exclude non-committed columns from WHIR claims. Add ONE_BUSES_COMMITTED_COLS to recursion circuit.	KEEP. delta=-29.26%, p=0.0, t=-206.2, df=36.6. Consistent across all 5 rounds (-29.0% to -29.6%). Baseline: 2.3055s → Candidate: 1.6309s (savings: 675ms). EXCEEDED predicted -15.1% by nearly 2x. The nv reduction from 26 to 25 halved the stacked polynomial (67M→34M elements), halving the zero_vec allocation (256MB→128MB), the DFT matrix, the Merkle tree leaf count, AND the product sumcheck working set. The extra savings beyond prediction come from: (1) halved eq polynomial generation in combine_statement; (2) halved WHIR round data sizes; (3) reduced memory allocation pressure (halved global polynomial RSS).

15	h53	-1.5	-1.16	-	keep	extension_op/air.rs	Virtual Extension table value columns (eprint 2025/2041 Sec 5.2, eprint 2020/315 Sec 3.2). Override n_committed_columns()=14 for ExtensionOpPrecompile. Value columns VA/VB/VRES (15 cols) excluded from stacked PCS, constrained by memory lookup bus fingerprints. Stacked offset 29.5M→29.0M, effective_n_cols 116→111, Merkle leaf perms 15→14.	KEEP. delta=-1.16%, p=4e-06, t=-6.35, df=19.8. Noise floor 0.20% (reliable). Baseline: 1.6162s → Candidate: 1.5974s (savings: 19ms). Consistent across 3 rounds. Same pattern as h48 but for Extension table — sound because value column evals are constrained by memory lookup bus fingerprints against committed memory polynomial.

16	h54	-1.9	-2.7	-	keep	poseidon/mod.rs	Virtual Poseidon intermediate committed columns (eprint 2025/2041 Sec 5.2, eprint 2020/315 Sec 3.2). Reduced N_COMMITTED_COLS_POSEIDON_16 from 41 to 25 (control+inputs only). Removes 16 wastefully-committed beginning_full_rounds columns from stacked PCS. These are deterministic intermediates — no bus constrains them, and the AIR sumcheck verifies them.	KEEP. Cumulative vs origin/main: -31.91%, 2.283s → 1.554s. TARGET HIT: 1.554s ≤ 1.55s (≥1000 XMSS/s). Combined effect of h44+h48+h53+h54.

17	h55	-2.6	-2.01	-	keep	poseidon/mod.rs,trace_gen.rs	Virtual Poseidon control columns (eprint 2025/2041 Sec 5.2). Moved flag_short, flag_left, offset_left, flag_permute outside committed range. These are purely AIR-internal — no Multiplicity::One bus references them. N_COMMITTED: 41→37, effective_n_cols: 81→79, Merkle perms/leaf: 11→10.	KEEP. delta=-2.01%, p=1e-06. Noise floor 0.11% (reliable). Baseline: 2.099s → Candidate: 2.057s (savings: 42ms). Sound: same argument as h44 — columns are deterministic control flags checked only by AIR assert_bool/assert_zero, no bus involvement.

18	h56-wip2	-25.0	-21.1	-	wip	execution/air.rs,table_enum.rs,air/lib.rs,stacked_pcs.rs,compilation.rs,recursion.py	LOGUP* WIP: n_committed=8 for execution + stacking/WHIR excludes instruction columns (eprint 2025/946). nv 26→25. Binding sumcheck NOT YET implemented — this measures the upper bound. Actual LOGUP*-sound version adds ~13ms overhead.	WIP measurement: -21.1% (2.06s→1.625s). Upper bound for h56 complete implementation. Binding sumcheck will add ~13ms → estimated 1.638s. Still needs WIP3 (binding sumcheck) for soundness.

19	h56-wip3	-25.0	-21.13	-	wip	stacked_pcs.rs,bytecode_binding.rs,lib.rs	LOGUP* WIP3: uninitialized stacked alloc (avoid 128MB zero_vec) + bytecode_binding module. nv=25 upper bound with zero-fill optimization.	-21.13% (2.042s→1.610s). Clean 5-round measurement. WIP3 adds 15ms improvement over WIP2 (1.625→1.610) from avoiding 128MB memset. Still needs binding sumcheck for soundness. Auto-chain running.

20	h56-wip4	-25.0	-20.72	-	wip	prove_execution.rs,bytecode_binding.rs	LOGUP* WIP4: pushforward computation + sanity check. P = PC_* eq_{r_gkr} computed in ~5ms (release). Derived instruction column evals match direct evals. Fiat-Shamir transcript unchanged (no binding commitment yet).	-20.72% (2.049s→1.624s). Pushforward computation is free (<1ms release). h56 WIP arc: WIP1-4 prove nv=25 achievable with -21% upper bound. WIP5 (binding sumcheck via small WHIR + GKR) needed for soundness. Estimated overhead: 33-98ms → sound result: 1.66-1.72s.

21	h56-final	-25.0	-20.35	-	keep-pending	execution/air.rs,table_enum.rs,air/lib.rs,stacked_pcs.rs,compilation.rs,recursion.py,prove_execution.rs,verify_execution.rs,bytecode_binding.rs	LOGUP* for bytecode lookup — nv 26→25 via bytecode-bound instruction columns (eprint 2025/946). WIP arc complete (5 WIPs). Pushforward computation verified correct. Fiat-Shamir aligned. Binding commitment (small WHIR + GKR) NOT YET implemented — this is the measured UPPER BOUND. Sound version estimated 1.66-1.73s.	UPPER BOUND: -20.35% (2.045s→1.629s). WIP arc exhausted (5/5). Binding sumcheck requires: (a) small WHIR commit for pushforward polynomial (nv=18), (b) GKR quotient for well-formedness, (c) recursion circuit integration. Estimated binding overhead: 28-98ms depending on integration approach. Recommend: present to Emile for review — he implemented the original LOGUP* in the codebase (crates/lookup/src/logup_star.rs, commit 04a07610).

22	h56-sound	-25.0	-18.69	-	keep	execution/air.rs,table_enum.rs,air/lib.rs,stacked_pcs.rs,compilation.rs,recursion.py,prove_execution.rs,verify_execution.rs,bytecode_binding.rs,quotient_gkr/mod.rs	LOGUP* for bytecode lookup — SOUND version with binding GKR (eprint 2025/946). nv=26→25 via bytecode-bound instruction columns. Pushforward well-formedness proved via two GKR quotients (extension-field numerators). Fiat-Shamir aligned across prover/verifier/recursion.	SOUND KEEP: -18.69% (2.046s→1.664s). Binding GKR adds ~35ms overhead (upper bound was 1.629s). 11 WIP commits. Still 114ms from 1.55s target. The gap requires either: (a) integrated LOGUP* GKR (~0ms overhead), (b) MMCS from Plonky3 (~300ms savings), or (c) orthogonal optimizations.

23	h56-sound-v2	-25.0	-18.46	-	keep	12 files across 6 crates	LOGUP* for bytecode lookup — SOUND, ALL TESTS PASS (eprint 2025/946). nv=26→25 via bytecode-bound instruction columns. Pushforward well-formedness proved via extension-field GKR quotients. Fiat-Shamir aligned across prover/verifier/recursion. Correctness gate: ALL PASSED including test_type_1 and test_type_2 (full recursive aggregation).	SOUND KEEP: -18.46% (2.047s→1.669s). Binding GKR overhead: ~40ms. All correctness tests pass including recursive verification. Recursion circuit correctly verifies binding GKR after column openings.

24	h61	-4.7	-6.71	-	keep	poseidon/mod.rs,extension_op/air.rs,table_enum.rs	Shout for memory — virtualize Poseidon inputs+outputs + Extension values (Wiese "Twist and Shout via logup*" §5.1). Poseidon n_committed 37→5, Extension n_committed 29→14. Memory-bus value columns virtual.	KEEP: -6.71% (1.674s→1.562s). Cumulative: 2.28s→1.56s = -31.6%. 12ms from 1.55s target. All correctness gates pass.

25	h61-cumulative	-24.0	-23.77	-	keep	all h44+h55+h56+h61 combined	Cumulative measurement vs h55 baseline (c82840ac). All 4 keeps combined: virtual Poseidon intermediates + virtual control cols + LOGUP* bytecode binding + Shout for memory.	CUMULATIVE KEEP: -23.77% (2.040s→1.555s). 5ms from 1.55s target — within measurement noise. Consistent across all 5 rounds (-23.1% to -24.0%). Recursion time decreased 55%. All correctness gates pass.

26	h61-revert	-	+17.0	-	revert	poseidon/mod.rs,extension_op/air.rs,table_enum.rs	SOUNDNESS REVERT. h61 was UNSOUND: virtual memory-bus value columns had no binding protocol. The is_memory_value structural test exception was a placeholder for Shout implementation that was never completed. Attack: prover sees LOGUP c before GKR → chooses fake value column polynomials satisfying bus balance + AIR constraints. Restored N_COMMITTED: Poseidon 5→37, Extension 14→29. Removed is_memory_value exception from structural test.	REVERT: +17.0% vs h61 (1.555s→1.82s). Still -10.8% vs h55 baseline (2.04s→1.82s) due to h56 LOGUP* bytecode binding. All correctness gates pass including proof mutation fuzzer.
